,date_,title,url,description,content
50,12-29-2024,"ONGOING DEADLINE ALERT: Faruqi & Faruqi, LLP Investigates Claims on Behalf of Investors of Enphase Energy",https://www.investing.com/news/press-releases/ongoing-deadline-alert-faruqi--faruqi-llp-investigates-claims-on-behalf-of-investors-of-enphase-energy-93CH-3790734,"ONGOING DEADLINE ALERT: Faruqi & Faruqi, LLP Investigates Claims on Behalf of Investors of Enphase Energy","Faruqi &amp; Faruqi, LLP Securities Litigation Partner James (Josh) Wilson Encourages Investors Who Suffered Losses Exceeding $100,000 In Enphase Energy (NASDAQ:ENPH) To Contact Him Directly To Discu… [+5885 chars]"
51,12-28-2024,"SHAREHOLDER ACTION REMINDER: Faruqi & Faruqi, LLP Investigates Claims on Behalf of Investors of Wolfspeed",https://www.investing.com/news/press-releases/shareholder-action-reminder-faruqi--faruqi-llp-investigates-claims-on-behalf-of-investors-of-wolfspeed-93CH-3790560,"SHAREHOLDER ACTION REMINDER: Faruqi & Faruqi, LLP Investigates Claims on Behalf of Investors of Wolfspeed","Faruqi &amp; Faruqi, LLP Securities Litigation Partner James (Josh) Wilson Encourages Investors Who Suffered Losses Exceeding $75,000 In Wolfspeed (NYSE:WOLF) To Contact Him Directly To Discuss Their… [+3539 chars]"
52,12-29-2024,"ROSEN, LEADING INVESTOR COUNSEL, Encourages Enphase Energy, Inc. Investors to Secure Counsel Before Important Deadline in Securities Class Action - ENPH",https://www.investing.com/news/press-releases/rosen-leading-investor-counsel-encourages-enphase-energy-inc-investors-to-secure-counsel-before-important-deadline-in-securities-class-action--enph-93CH-3790641,"ROSEN, LEADING INVESTOR COUNSEL, Encourages Enphase Energy, Inc. Investors to Secure Counsel Before Important Deadline in Securities Class Action - ENPH","New York, New York--(Newsfile Corp. - December 28, 2024) - WHY: Rosen Law Firm, a global investor rights law firm, reminds purchasers of common stock of Enphase Energy, Inc. (NASDAQ: NASDAQ:ENPH) bet… [+3551 chars]"
53,12-28-2024,"ROSEN, A HIGHLY RECOGNIZED FIRM, Encourages Enphase Energy, Inc. Investors to Secure Counsel Before Important Deadline in Securities Class Action - ENPH",https://www.investing.com/news/press-releases/rosen-a-highly-recognized-firm-encourages-enphase-energy-inc-investors-to-secure-counsel-before-important-deadline-in-securities-class-action--enph-93CH-3790352,"ROSEN, A HIGHLY RECOGNIZED FIRM, Encourages Enphase Energy, Inc. Investors to Secure Counsel Before Important Deadline in Securities Class Action - ENPH","New York, New York--(Newsfile Corp. - December 27, 2024) - WHY: Rosen Law Firm, a global investor rights law firm, reminds purchasers of common stock of Enphase Energy, Inc. (NASDAQ: NASDAQ:ENPH) bet… [+3551 chars]"
54,12-29-2024,"Grabar Law Office Investigates Claims on Behalf of Current Long-term Shareholders of Expensify, Inc. (EXFY)",https://www.investing.com/news/press-releases/grabar-law-office-investigates-claims-on-behalf-of-current-longterm-shareholders-of-expensify-inc-exfy-93CH-3790668,"Grabar Law Office Investigates Claims on Behalf of Current Long-term Shareholders of Expensify, Inc. (EXFY)","Philadelphia, Pennsylvania--(Newsfile Corp. - December 29, 2024) - Grabar Law Office is investigating whether certain officers and directors of Expensify , Inc. (NASDAQ: NASDAQ:EXFY) breached their f… [+2689 chars]"
55,12-29-2024,"CPRI INVESTOR ALERT: Capri Holdings Limited Investors that Lost Money are Reminded of February 21 Class Action Deadline, Contact BFA Law",https://www.investing.com/news/press-releases/cpri-investor-alert-capri-holdings-limited-investors-that-lost-money-are-reminded-of-february-21-class-action-deadline-contact-bfa-law-93CH-3790761,"CPRI INVESTOR ALERT: Capri Holdings Limited Investors that Lost Money are Reminded of February 21 Class Action Deadline, Contact BFA Law","New York, New York--(Newsfile Corp. - December 29, 2024) - Leading securities law firm Bleichmar Fonti &amp; Auld LLP announces that a lawsuit has been filed against Capri Holdings Limited (NYSE: NYS… [+3807 chars]"
56,12-29-2024,Cabot's top 10 trader and top pick,https://www.investing.com/news/stock-market-news/cabots-top-10-trader-and-top-pick-3790102,Cabot's top 10 trader and top pick,"Investing.com -- Cabot gave its weekly top ten stock list, naming Kyndryl Holdings (NYSE:KD) its top pick given its attractive entry point.
As for the market, things finished up with a nice rally la… [+1665 chars]"
57,12-28-2024,"ROSEN, A LEADING NATIONAL FIRM, Encourages Kyverna Therapeutics, Inc. Investors to Secure Counsel Before Important Deadline in Securities Class Action - KYTX",https://www.investing.com/news/press-releases/rosen-a-leading-national-firm-encourages-kyverna-therapeutics-inc-investors-to-secure-counsel-before-important-deadline-in-securities-class-action--kytx-93CH-3790353,"ROSEN, A LEADING NATIONAL FIRM, Encourages Kyverna Therapeutics, Inc. Investors to Secure Counsel Before Important Deadline in Securities Class Action - KYTX","New York, New York--(Newsfile Corp. - December 27, 2024) - WHY: Rosen Law Firm, a global investor rights law firm, reminds purchasers of common stock of Kyverna Therapeutics, Inc. (NASDAQ: KYTX) purs… [+3569 chars]"
58,12-28-2024,"ROSEN, A RESPECTED AND LEADING FIRM, Encourages MGP Ingredients, Inc. Investors to Secure Counsel Before Important Deadline in Securities Class Action - MGPI",https://www.investing.com/news/press-releases/rosen-a-respected-and-leading-firm-encourages-mgp-ingredients-inc-investors-to-secure-counsel-before-important-deadline-in-securities-class-action--mgpi-93CH-3790355,"ROSEN, A RESPECTED AND LEADING FIRM, Encourages MGP Ingredients, Inc. Investors to Secure Counsel Before Important Deadline in Securities Class Action - MGPI","New York, New York--(Newsfile Corp. - December 27, 2024) - WHY: Rosen Law Firm, a global investor rights law firm, reminds purchasers of common stock of MGP Ingredients , Inc. (NASDAQ: NASDAQ:MGPI) b… [+3720 chars]"
59,12-29-2024,ASML CLASS ACTION NOTICE: ASML Holding Investors that Suffered Losses are Notified to Contact BFA Law before January 13 Court Deadline,https://www.investing.com/news/press-releases/asml-class-action-notice-asml-holding-investors-that-suffered-losses-are-notified-to-contact-bfa-law-before-january-13-court-deadline-93CH-3790733,ASML CLASS ACTION NOTICE: ASML Holding Investors that Suffered Losses are Notified to Contact BFA Law before January 13 Court Deadline,"New York, New York--(Newsfile Corp. - December 29, 2024) - Leading securities law firm Bleichmar Fonti &amp; Auld LLP announces that it has filed a class actions lawsuit for violations of the federal… [+3663 chars]"
60,12-28-2024,"ROSEN, A LEADING INVESTOR RIGHTS LAW FIRM, Encourages Celsius Holdings, Inc. Investors to Secure Counsel Before Important Deadline in Securities Class Action - CELH",https://www.investing.com/news/press-releases/rosen-a-leading-investor-rights-law-firm-encourages-celsius-holdings-inc-investors-to-secure-counsel-before-important-deadline-in-securities-class-action--celh-93CH-3790579,"ROSEN, A LEADING INVESTOR RIGHTS LAW FIRM, Encourages Celsius Holdings, Inc. Investors to Secure Counsel Before Important Deadline in Securities Class Action - CELH","New York, New York--(Newsfile Corp. - December 28, 2024) - WHY: Rosen Law Firm, a global investor rights law firm, reminds purchasers of common stock of Celsius Holdings , Inc. (NASDAQ: NASDAQ:CELH) … [+4054 chars]"
61,12-29-2024,"ROSEN, A GLOBAL AND LEADING LAW FIRM, Encourages MGP Ingredients, Inc. Investors to Secure Counsel Before Important Deadline in Securities Class Action - MGPI",https://www.investing.com/news/press-releases/rosen-a-global-and-leading-law-firm-encourages-mgp-ingredients-inc-investors-to-secure-counsel-before-important-deadline-in-securities-class-action--mgpi-93CH-3790643,"ROSEN, A GLOBAL AND LEADING LAW FIRM, Encourages MGP Ingredients, Inc. Investors to Secure Counsel Before Important Deadline in Securities Class Action - MGPI","New York, New York--(Newsfile Corp. - December 28, 2024) - WHY: Rosen Law Firm, a global investor rights law firm, reminds purchasers of common stock of MGP Ingredients , Inc. (NASDAQ: NASDAQ:MGPI) b… [+3720 chars]"
62,12-29-2024,"ROSEN, TRUSTED INVESTOR COUNSEL, Encourages Celsius Holdings, Inc. Investors to Secure Counsel Before Important Deadline in Securities Class Action - CELH",https://www.investing.com/news/press-releases/rosen-trusted-investor-counsel-encourages-celsius-holdings-inc-investors-to-secure-counsel-before-important-deadline-in-securities-class-action--celh-93CH-3790811,"ROSEN, TRUSTED INVESTOR COUNSEL, Encourages Celsius Holdings, Inc. Investors to Secure Counsel Before Important Deadline in Securities Class Action - CELH","New York, New York--(Newsfile Corp. - December 29, 2024) - WHY: Rosen Law Firm, a global investor rights law firm, reminds purchasers of common stock of Celsius Holdings , Inc. (NASDAQ: NASDAQ:CELH) … [+4054 chars]"
63,12-29-2024,"HAS DEADLINE ALERT: ROSEN, NATIONALLY REGARDED INVESTOR COUNSEL, Encourages Hasbro, Inc. Investors with Losses in Excess of $100K to Secure Counsel Before Important Deadline in Securities Class Action",https://www.investing.com/news/press-releases/has-deadline-alert-rosen-nationally-regarded-investor-counsel-encourages-hasbro-inc-investors-with-losses-in-excess-of-100k-to-secure-counsel-before-important-deadline-in-securities-class-action-93CH-3790798,"HAS DEADLINE ALERT: ROSEN, NATIONALLY REGARDED INVESTOR COUNSEL, Encourages Hasbro, Inc. Investors with Losses in Excess of $100K to Secure Counsel Before Important Deadline in Securities Class Action","New York, New York--(Newsfile Corp. - December 29, 2024) - WHY: Rosen Law Firm, a global investor rights law firm, reminds purchasers of common stock of Hasbro, Inc. (NASDAQ: NASDAQ:HAS) between Febr… [+3663 chars]"
64,12-29-2024,"ROSEN, TOP-RANKED INVESTOR COUNSEL, Encourages Kyverna Therapeutics, Inc. Investors to Secure Counsel Before Important Deadline in Securities Class Action - KYTX",https://www.investing.com/news/press-releases/rosen-topranked-investor-counsel-encourages-kyverna-therapeutics-inc-investors-to-secure-counsel-before-important-deadline-in-securities-class-action--kytx-93CH-3790642,"ROSEN, TOP-RANKED INVESTOR COUNSEL, Encourages Kyverna Therapeutics, Inc. Investors to Secure Counsel Before Important Deadline in Securities Class Action - KYTX","New York, New York--(Newsfile Corp. - December 28, 2024) - WHY: Rosen Law Firm, a global investor rights law firm, reminds purchasers of common stock of Kyverna Therapeutics, Inc. (NASDAQ: KYTX) purs… [+3569 chars]"
65,12-28-2024,"SHAREHOLDER ACTION REMINDER: Faruqi & Faruqi, LLP Investigates Claims on Behalf of Investors of Symbotic",https://www.investing.com/news/press-releases/shareholder-action-reminder-faruqi--faruqi-llp-investigates-claims-on-behalf-of-investors-of-symbotic-93CH-3790557,"SHAREHOLDER ACTION REMINDER: Faruqi & Faruqi, LLP Investigates Claims on Behalf of Investors of Symbotic","Faruqi &amp; Faruqi, LLP Securities Litigation Partner James (Josh) Wilson Encourages Investors Who Suffered Losses Exceeding $100,000 In Symbotic To Contact Him Directly To Discuss Their Options
If… [+3558 chars]"
66,12-28-2024,"SHAREHOLDER ACTION REMINDER: Faruqi & Faruqi, LLP Investigates Claims on Behalf of Investors of Humacyte",https://www.investing.com/news/press-releases/shareholder-action-reminder-faruqi--faruqi-llp-investigates-claims-on-behalf-of-investors-of-humacyte-93CH-3790561,"SHAREHOLDER ACTION REMINDER: Faruqi & Faruqi, LLP Investigates Claims on Behalf of Investors of Humacyte","Faruqi &amp; Faruqi, LLP Securities Litigation Partner James (Josh) Wilson Encourages Investors Who Suffered Losses Exceeding $75,000 In Humacyte To Contact Him Directly To Discuss Their Options
If … [+4191 chars]"
67,12-29-2024,"PACS IMPORTANT DEADLINE: ROSEN, SKILLED INVESTOR COUNSEL, Encourages PACS Group Inc. Investors with Losses in Excess of $100K to Secure Counsel Before Important Deadline in Securities Class Action - P",https://www.investing.com/news/press-releases/pacs-important-deadline-rosen-skilled-investor-counsel-encourages-pacs-group-inc-investors-with-losses-in-excess-of-100k-to-secure-counsel-before-important-deadline-in-securities-class-action--p-93CH-3790808,"PACS IMPORTANT DEADLINE: ROSEN, SKILLED INVESTOR COUNSEL, Encourages PACS Group Inc. Investors with Losses in Excess of $100K to Secure Counsel Before Important Deadline in Securities Class Action - P","New York, New York--(Newsfile Corp. - December 29, 2024) - WHY:Rosen Law Firm, a global investor rights law firm, reminds purchasers of PACS Group Inc. (NYSE: PACS) of (i) common stock pursuant and/o… [+4252 chars]"
68,12-28-2024,"PACS FINAL DEADLINE: ROSEN, A GLOBALLY RESPECTED LAW FIRM, Encourages PACS Group Inc. Investors with Losses in Excess of $100K to Secure Counsel Before Important Deadline in Securities Class Action -",https://www.investing.com/news/press-releases/pacs-final-deadline-rosen-a-globally-respected-law-firm-encourages-pacs-group-inc-investors-with-losses-in-excess-of-100k-to-secure-counsel-before-important-deadline-in-securities-class-action--93CH-3790578,"PACS FINAL DEADLINE: ROSEN, A GLOBALLY RESPECTED LAW FIRM, Encourages PACS Group Inc. Investors with Losses in Excess of $100K to Secure Counsel Before Important Deadline in Securities Class Action -","New York, New York--(Newsfile Corp. - December 28, 2024) - WHY: Rosen Law Firm, a global investor rights law firm, reminds purchasers of PACS Group Inc. (NYSE: PACS) of (i) common stock pursuant and/… [+4253 chars]"
69,12-29-2024,"ONGOING DEADLINE ALERT: Faruqi & Faruqi, LLP Investigates Claims on Behalf of Investors of DMC",https://www.investing.com/news/press-releases/ongoing-deadline-alert-faruqi--faruqi-llp-investigates-claims-on-behalf-of-investors-of-dmc-93CH-3790742,"ONGOING DEADLINE ALERT: Faruqi & Faruqi, LLP Investigates Claims on Behalf of Investors of DMC","Faruqi &amp; Faruqi, LLP Securities Litigation Partner James (Josh) Wilson Encourages Investors Who Suffered Losses Exceeding $75,000 In DMC To Contact Him Directly To Discuss Their Options
If you s… [+4543 chars]"
70,12-28-2024,"Avid Bioservices' chief commercial officer sells shares worth $163,625",https://www.investing.com/news/insider-trading-news/avid-bioservices-chief-commercial-officer-sells-shares-worth-163625-93CH-3790286,"Avid Bioservices' chief commercial officer sells shares worth $163,625","Kwietniak's transactions are part of a broader pattern of equity awards and sales, which are often used by executives to manage their tax liabilities and compensation. The company's stock has demonst… [+2206 chars]"
71,12-28-2024,'Rich Dad Poor Dad' Author Doubles Down on His Bitcoin $350K Prediction for 2025,https://www.investing.com/news/cryptocurrency-news/rich-dad-poor-dad-author-doubles-down-on-his-bitcoin-350k-prediction-for-2025-3790498,'Rich Dad Poor Dad' Author Doubles Down on His Bitcoin $350K Prediction for 2025,"U.Today - Robert Kiyosaki, investor and financial expert, also known for authoring a best-selling book on finances “Rich Dad Poor Dad,” has published a tweet about Bitcoin and the BlackRock (NYSE:BLK… [+2158 chars]"
72,12-28-2024,China to cut import tariffs on some recycled copper and aluminium raw materials,https://www.investing.com/news/commodities-news/china-to-cut-import-tariffs-on-some-recycled-copper-and-aluminium-raw-materials-3790310,China to cut import tariffs on some recycled copper and aluminium raw materials,"SHANGHAI (Reuters) - China will reduce import tariffs on ethane and certain recycled copper and aluminium raw materials from next year, the government said on Saturday.
The Ministry of Finance annou… [+1074 chars]"
73,12-28-2024,"SHAREHOLDER ACTION REMINDER: Faruqi & Faruqi, LLP Investigates Claims on Behalf of Investors of Visa",https://www.investing.com/news/press-releases/shareholder-action-reminder-faruqi--faruqi-llp-investigates-claims-on-behalf-of-investors-of-visa-93CH-3790570,"SHAREHOLDER ACTION REMINDER: Faruqi & Faruqi, LLP Investigates Claims on Behalf of Investors of Visa","Faruqi &amp; Faruqi, LLP Securities Litigation Partner James (Josh) Wilson Encourages Investors Who Suffered Losses Exceeding $100,000 In Visa To Contact Him Directly To Discuss Their Options
If you… [+4006 chars]"
74,12-29-2024,"ONGOING DEADLINE ALERT: Faruqi & Faruqi, LLP Investigates Claims on Behalf of Investors of Warner Bros. Discovery",https://www.investing.com/news/press-releases/ongoing-deadline-alert-faruqi--faruqi-llp-investigates-claims-on-behalf-of-investors-of-warner-bros-discovery-93CH-3790763,"ONGOING DEADLINE ALERT: Faruqi & Faruqi, LLP Investigates Claims on Behalf of Investors of Warner Bros. Discovery","Faruqi &amp; Faruqi, LLP Securities Litigation Partner James (Josh) Wilson Encourages Investors Who Suffered Losses Exceeding $100,000 In Warner Bros. Discovery (NASDAQ:WBD) To Contact Him Directly T… [+4247 chars]"
75,12-28-2024,Paper & forest products 2025 outlook and top stocks to own,https://www.investing.com/news/stock-market-news/paper--forest-products-2025-outlook-and-top-stocks-to-own-3785432,Paper & forest products 2025 outlook and top stocks to own,"Investing.com -- RBC Capital Markets expects a cyclical recovery in containerboard and tighter supply in the lumber market to bolster North American producers in 2025, despite lingering challenges fr… [+1588 chars]"
76,12-28-2024,"SHAREHOLDER ACTION REMINDER: Faruqi & Faruqi, LLP Investigates Claims on Behalf of Investors of Chipotle Mexican Grill",https://www.investing.com/news/press-releases/shareholder-action-reminder-faruqi--faruqi-llp-investigates-claims-on-behalf-of-investors-of-chipotle-mexican-grill-93CH-3790536,"SHAREHOLDER ACTION REMINDER: Faruqi & Faruqi, LLP Investigates Claims on Behalf of Investors of Chipotle Mexican Grill","Faruqi &amp; Faruqi, LLP Securities Litigation Partner James (Josh) Wilson Encourages Investors Who Suffered Losses Exceeding $100,000 In Chipotle To Contact Him Directly To Discuss Their Options
If… [+3512 chars]"
77,12-28-2024,"ROSEN, NATIONALLY REGARDED INVESTOR COUNSEL, Encourages Dentsply Sirona Inc. Investors to Secure Counsel Before Important Deadline in Securities Class Action - XRAY",https://www.investing.com/news/press-releases/rosen-nationally-regarded-investor-counsel-encourages-dentsply-sirona-inc-investors-to-secure-counsel-before-important-deadline-in-securities-class-action--xray-93CH-3790296,"ROSEN, NATIONALLY REGARDED INVESTOR COUNSEL, Encourages Dentsply Sirona Inc. Investors to Secure Counsel Before Important Deadline in Securities Class Action - XRAY","New York, New York--(Newsfile Corp. - December 27, 2024) - WHY: Rosen Law Firm, a global investor rights law firm, reminds purchasers of common stock of Dentsply Sirona Inc. (NASDAQ: XRAY) between Fe… [+4670 chars]"
78,12-29-2024,"CMG DEADLINE ALERT: ROSEN, A TRUSTED AND LEADING LAW FIRM, Encourages Chipotle Mexican Grill, Inc. Investors with Losses in Excess of $100K to Secure Counsel Before Important Deadline in Securities Cl",https://www.investing.com/news/press-releases/cmg-deadline-alert-rosen-a-trusted-and-leading-law-firm-encourages-chipotle-mexican-grill-inc-investors-with-losses-in-excess-of-100k-to-secure-counsel-before-important-deadline-in-securities-cl-93CH-3790640,"CMG DEADLINE ALERT: ROSEN, A TRUSTED AND LEADING LAW FIRM, Encourages Chipotle Mexican Grill, Inc. Investors with Losses in Excess of $100K to Secure Counsel Before Important Deadline in Securities Cl","New York, New York--(Newsfile Corp. - December 28, 2024) - WHY: Rosen Law Firm, a global investor rights law firm, reminds purchasers of common stock of Chipotle Mexican Grill, Inc. (NYSE: NYSE:CMG) … [+3854 chars]"
79,12-28-2024,"CMG DEADLINE ALERT: ROSEN, A LEADING NATIONAL FIRM, Encourages Chipotle Mexican Grill, Inc. Investors with Losses in Excess of $100K to Secure Counsel Before Important Deadline in Securities Class Act",https://www.investing.com/news/press-releases/cmg-deadline-alert-rosen-a-leading-national-firm-encourages-chipotle-mexican-grill-inc-investors-with-losses-in-excess-of-100k-to-secure-counsel-before-important-deadline-in-securities-class-act-93CH-3790351,"CMG DEADLINE ALERT: ROSEN, A LEADING NATIONAL FIRM, Encourages Chipotle Mexican Grill, Inc. Investors with Losses in Excess of $100K to Secure Counsel Before Important Deadline in Securities Class Act","New York, New York--(Newsfile Corp. - December 27, 2024) - WHY: Rosen Law Firm, a global investor rights law firm, reminds purchasers of common stock of Chipotle Mexican Grill, Inc. (NYSE: NYSE:CMG) … [+3854 chars]"
80,12-29-2024,"ROSEN, NATIONAL INVESTOR COUNSEL, Encourages Dentsply Sirona Inc. Investors to Secure Counsel Before Important Deadline in Securities Class Action - XRAY",https://www.investing.com/news/press-releases/rosen-national-investor-counsel-encourages-dentsply-sirona-inc-investors-to-secure-counsel-before-important-deadline-in-securities-class-action--xray-93CH-3790625,"ROSEN, NATIONAL INVESTOR COUNSEL, Encourages Dentsply Sirona Inc. Investors to Secure Counsel Before Important Deadline in Securities Class Action - XRAY","New York, New York--(Newsfile Corp. - December 28, 2024) - WHY: Rosen Law Firm, a global investor rights law firm, reminds purchasers of common stock of Dentsply Sirona Inc. (NASDAQ: XRAY) between Fe… [+4670 chars]"
81,12-29-2024,"US and Bitcoin Standard, Here's Big Catch, According to CryptoQuant CEO",https://www.investing.com/news/cryptocurrency-news/us-and-bitcoin-standard-heres-big-catch-according-to-cryptoquant-ceo-3790623,"US and Bitcoin Standard, Here's Big Catch, According to CryptoQuant CEO","U.Today - Ki Young Ju, founder and CEO of the CryptoQuant on-chain analytics company, has taken to social media to share his take on the prospects of the U.S. adopting the Bitcoin Standard in the nea… [+1423 chars]"
82,12-29-2024,"ONGOING DEADLINE ALERT: Faruqi & Faruqi, LLP Investigates Claims on Behalf of Investors of Mynaric",https://www.investing.com/news/press-releases/ongoing-deadline-alert-faruqi--faruqi-llp-investigates-claims-on-behalf-of-investors-of-mynaric-93CH-3790768,"ONGOING DEADLINE ALERT: Faruqi & Faruqi, LLP Investigates Claims on Behalf of Investors of Mynaric","Faruqi &amp; Faruqi, LLP Securities Litigation Partner James (Josh) Wilson Encourages Investors Who Suffered Losses Exceeding $50,000 In Mynaric (ETR:M0YNn) To Contact Him Directly To Discuss Their O… [+5438 chars]"
83,12-28-2024,"SHAREHOLDER ACTION REMINDER: Faruqi & Faruqi, LLP Investigates Claims on Behalf of Investors of Customers Bancor",https://www.investing.com/news/press-releases/shareholder-action-reminder-faruqi--faruqi-llp-investigates-claims-on-behalf-of-investors-of-customers-bancor-93CH-3790546,"SHAREHOLDER ACTION REMINDER: Faruqi & Faruqi, LLP Investigates Claims on Behalf of Investors of Customers Bancor","Faruqi &amp; Faruqi, LLP Securities Litigation Partner James (Josh) Wilson Encourages Investors Who Suffered Losses Exceeding $75,000 In Customers Bancorp (NYSE:CUBI) To Contact Him Directly To Discu… [+4236 chars]"
84,12-28-2024,"SHAREHOLDER ACTION REMINDER: Faruqi & Faruqi, LLP Investigates Claims on Behalf of Investors of Flux Power",https://www.investing.com/news/press-releases/shareholder-action-reminder-faruqi--faruqi-llp-investigates-claims-on-behalf-of-investors-of-flux-power-93CH-3790545,"SHAREHOLDER ACTION REMINDER: Faruqi & Faruqi, LLP Investigates Claims on Behalf of Investors of Flux Power","Faruqi &amp; Faruqi, LLP Securities Litigation Partner James (Josh) Wilson Encourages Investors Who Suffered Losses Exceeding $50,000 In Flux Power To Contact Him Directly To Discuss Their Options
I… [+4500 chars]"
85,12-28-2024,"Cathie Wood's ARK buys AMD and TEMPUS AI, sells ARCHER AVIATION",https://www.investing.com/news/company-news/cathie-woods-ark-buys-amd-and-tempus-ai-sells-archer-aviation-93CH-3790293,"Cathie Wood's ARK buys AMD and TEMPUS AI, sells ARCHER AVIATION","Cathie Wood's ARK ETFs have published their daily trades for Friday, December 27th, 2024, with significant activity across several sectors. Leading the purchases was Advanced Micro Devices Inc (NASDA… [+2176 chars]"
86,12-28-2024,Turkiye Garanti gets nod for green debt issuance,https://www.investing.com/news/company-news/turkiye-garanti-gets-nod-for-green-debt-issuance-93CH-3790555,Turkiye Garanti gets nod for green debt issuance,"ISTANBUL - Turkiye Garanti Bankasi (IS:GARAN) A.S. (TGBD) has received approval from the Capital Markets Board (CMB) to issue green and sustainable debt instruments. The approval, announced on Decemb… [+1910 chars]"
87,12-28-2024,Italian parliament gives final approval to government's 2025 budget,https://www.investing.com/news/economy-news/italian-parliament-gives-final-approval-to-governments-2025-budget-3790551,Italian parliament gives final approval to government's 2025 budget,"ROME (Reuters) - The Italian Senate on Saturday passed the government's deficit-cutting 2025 budget, giving parliament's final approval to the package which becomes law just ahead of an end-year dead… [+1817 chars]"
88,12-28-2024,"SHAREHOLDER ACTION REMINDER: Faruqi & Faruqi, LLP Investigates Claims on Behalf of Investors of Hasbro",https://www.investing.com/news/press-releases/shareholder-action-reminder-faruqi--faruqi-llp-investigates-claims-on-behalf-of-investors-of-hasbro-93CH-3790544,"SHAREHOLDER ACTION REMINDER: Faruqi & Faruqi, LLP Investigates Claims on Behalf of Investors of Hasbro","Faruqi &amp; Faruqi, LLP Securities Litigation Partner James (Josh) Wilson Encourages Investors Who Suffered Losses Exceeding $100,000 In Hasbro (NASDAQ:HAS) To Contact Him Directly To Discuss Their … [+4208 chars]"
