,date_,title,url,description,content
89,12-29-2024,PACS CLASS ACTION NOTICE: PACS Group Investors that Suffered Losses are Notified to Contact BFA Law before January 13 Court Deadline,https://www.investing.com/news/press-releases/pacs-class-action-notice-pacs-group-investors-that-suffered-losses-are-notified-to-contact-bfa-law-before-january-13-court-deadline-93CH-3790736,PACS CLASS ACTION NOTICE: PACS Group Investors that Suffered Losses are Notified to Contact BFA Law before January 13 Court Deadline,"New York, New York--(Newsfile Corp. - December 29, 2024) - Leading securities law firm Bleichmar Fonti &amp; Auld LLP announces that a lawsuit has been filed against PACS Group, Inc. (NYSE: PACS) and… [+4124 chars]"
90,12-29-2024,"APLT CLASS ACTION NOTICE: Applied Therapeutics, Inc. Investors that Suffered Losses are Notified to Contact BFA Law before February 18 Court Deadline",https://www.investing.com/news/press-releases/aplt-class-action-notice-applied-therapeutics-inc-investors-that-suffered-losses-are-notified-to-contact-bfa-law-before-february-18-court-deadline-93CH-3790771,"APLT CLASS ACTION NOTICE: Applied Therapeutics, Inc. Investors that Suffered Losses are Notified to Contact BFA Law before February 18 Court Deadline","New York, New York--(Newsfile Corp. - December 29, 2024) - Leading securities law firm Bleichmar Fonti &amp; Auld LLP announces that a lawsuit has been filed against Applied Therapeutics, Inc. (NASDA… [+4583 chars]"
91,12-28-2024,"DEADLINE APPROACHING: Berger Montague Advises Evolv Technologies (EVLV) Investors to Inquire About a Securities Fraud Class Action by December 31, 2024",https://www.investing.com/news/press-releases/deadline-approaching-berger-montague-advises-evolv-technologies-evlv-investors-to-inquire-about-a-securities-fraud-class-action-by-december-31-2024-93CH-3790610,"DEADLINE APPROACHING: Berger Montague Advises Evolv Technologies (EVLV) Investors to Inquire About a Securities Fraud Class Action by December 31, 2024","Philadelphia, Pennsylvania--(Newsfile Corp. - December 28, 2024) - Berger Montague PC advises investors that a securities class action lawsuit has been filed against Evolv Technologies Holdings, Inc.… [+3437 chars]"
92,12-29-2024,ZETA CLASS ACTION NOTICE: Zeta Global Holdings Investors that Suffered Losses are Notified to Contact BFA Law before January 21 Court Deadline,https://www.investing.com/news/press-releases/zeta-class-action-notice-zeta-global-holdings-investors-that-suffered-losses-are-notified-to-contact-bfa-law-before-january-21-court-deadline-93CH-3790737,ZETA CLASS ACTION NOTICE: Zeta Global Holdings Investors that Suffered Losses are Notified to Contact BFA Law before January 21 Court Deadline,"New York, New York--(Newsfile Corp. - December 29, 2024) - Leading securities law firm Bleichmar Fonti &amp; Auld LLP announces that a lawsuit has been filed against Zeta Global Holdings Corp. (NYSE:… [+3385 chars]"
93,12-29-2024,"BIOA INVESTOR NOTICE: BioAge Labs, Inc. Investors that Lost Money are Notified to Contact BFA Law about its Continuing Investigation into the Company",https://www.investing.com/news/press-releases/bioa-investor-notice-bioage-labs-inc-investors-that-lost-money-are-notified-to-contact-bfa-law-about-its-continuing-investigation-into-the-company-93CH-3790735,"BIOA INVESTOR NOTICE: BioAge Labs, Inc. Investors that Lost Money are Notified to Contact BFA Law about its Continuing Investigation into the Company","New York, New York--(Newsfile Corp. - December 29, 2024) - Leading securities law firm Bleichmar Fonti &amp; Auld LLP announces an investigation into BioAge Labs, Inc. (NASDAQ: BIOA) for potential vi… [+2863 chars]"
94,12-29-2024,"MQ CLASS ACTION NOTICE: Marqeta, Inc. Investors that Suffered Losses are Notified to Contact BFA Law before February 7 Court Deadline",https://www.investing.com/news/press-releases/mq-class-action-notice-marqeta-inc-investors-that-suffered-losses-are-notified-to-contact-bfa-law-before-february-7-court-deadline-93CH-3790738,"MQ CLASS ACTION NOTICE: Marqeta, Inc. Investors that Suffered Losses are Notified to Contact BFA Law before February 7 Court Deadline","New York, New York--(Newsfile Corp. - December 29, 2024) - Leading securities law firm Bleichmar Fonti &amp; Auld LLP announces that a lawsuit has been filed against Marqeta , Inc. (NASDAQ: NASDAQ:MQ… [+3496 chars]"
95,12-29-2024,"IDEAYA Biosciences Enters Exclusive License with Hengrui Pharma for SHR-4849, a Novel Phase 1 DLL3 Topo-I-Payload ADC Targeting SCLC and NET Solid Tumors",https://www.investing.com/news/press-releases/ideaya-biosciences-enters-exclusive-license-with-hengrui-pharma-for-shr4849-a-novel-phase-1-dll3-topoipayload-adc-targeting-sclc-and-net-solid-tumors-93CH-3790731,"IDEAYA Biosciences Enters Exclusive License with Hengrui Pharma for SHR-4849, a Novel Phase 1 DLL3 Topo-I-Payload ADC Targeting SCLC and NET Solid Tumors","<ul><li>Exclusive global license outside of Greater China
 for SHR-4849, a Phase 1 DLL3-targeting Topo-I-payload antibody drug conjugate (ADC)</li><li>DLL3 highly expressed in Small Cell Lung Cancer… [+7675 chars]"
96,12-29-2024,"ONGOING DEADLINE ALERT: Faruqi & Faruqi, LLP Investigates Claims on Behalf of Investors of Five9",https://www.investing.com/news/press-releases/ongoing-deadline-alert-faruqi--faruqi-llp-investigates-claims-on-behalf-of-investors-of-five9-93CH-3790740,"ONGOING DEADLINE ALERT: Faruqi & Faruqi, LLP Investigates Claims on Behalf of Investors of Five9","Faruqi &amp; Faruqi, LLP Securities Litigation Partner James (Josh) Wilson Encourages Investors Who Suffered Losses Exceeding $75,000 In Five9 (NASDAQ:FIVN) To Contact Him Directly To Discuss Their O… [+3932 chars]"
97,12-29-2024,Saudi Arabia stocks higher at close of trade; Tadawul All Share up 0.28%,https://www.investing.com/news/stock-market-news/saudi-arabia-stocks-higher-at-close-of-trade-tadawul-all-share-up-028-3790743,Saudi Arabia stocks higher at close of trade; Tadawul All Share up 0.28%,"Investing.com Saudi Arabia stocks were higher after the close on Sunday, as gains in the Real Estate Development, Insurance and Energy &amp; Utilities sectors led shares higher.
At the close in Saud… [+1362 chars]"
98,12-29-2024,Israel stocks lower at close of trade; TA 35 down 0.24%,https://www.investing.com/news/stock-market-news/israel-stocks-lower-at-close-of-trade-ta-35-down-024-3790776,Israel stocks lower at close of trade; TA 35 down 0.24%,"Investing.com Israel stocks were lower after the close on Sunday, as losses in the Biomed, Banking and Oil &amp; Gas sectors led shares lower.
At the close in Tel Aviv, the TA 35 declined 0.24%.
Th… [+1499 chars]"
99,12-29-2024,"Roche has no plans for job cuts and business is healthy, CEO says",https://www.investing.com/news/stock-market-news/roche-has-no-plans-for-job-cuts-and-business-is-healthy-ceo-says-3790803,"Roche has no plans for job cuts and business is healthy, CEO says","ZURICH (Reuters) - Swiss pharmaceutical company Roche is not planning job cuts and its business is healthy, CEO Thomas Schinecker was quoted as saying by a Swiss newspaper on Sunday.
Roche's share p… [+1054 chars]"
